{"id":"app_09b374c462ec4d64","name":"customer-value-health","version":"v0.2.3","desc":"ONES 客户价值与应用健康度报告：按周期生成不可变报告快照，产出客户价值报告、应用健康度报告、增购机会建议和客户版 PDF。","logo":"/public/logo.svg","auth":{"type":"jwt"},"lifecycle_callback":{"install":"/install_cb","enabled":"/enabled_cb","disabled":"/disabled_cb","uninstalled":"/uninstalled_cb"},"oauth":{"scope":["read:account:teams","read:account:user","read:project:project","read:project:sprint","read:project:issue","read:project:issueField","read:project:issueType","read:project:issue-comment","read:project:issue-timeSpent","read:project:workLog-timeEstimated","read:wiki:space","read:wiki:page","read:testcase:library","read:license:app"],"type":["app","user"]},"extensions":{"appSettingPages":[{"key":"entries","funcs":{"customEntries":"/app_setting_entries"}}]},"base_url":"https://cdn.jsdelivr.net/gh/opyamorpen/Value-and-Health-Report@deploy/v0.2.3/public/customer-value-health-v0.2.3.opkx"}